{
  "$schema": "../jsonSchemas/questions.schema.json", 
  "version": "1.0",
  "source": "DP.pdf + DP_orai.pdf",
  "language": "hu",
  "questions": [
    {
      "id": "DP-1",
      "topic": "strategia",
      "type": "true_false",
      "prompt": "A dinamikus programozás egyik alapelve, hogy a részproblémák megoldásait eltároljuk, és újra felhasználjuk.",
      "answer": true,
      "explanation": "A tárolt részprobléma-eredmények (memorizálás / táblázatkitöltés) adják a módszer lényegét.",
      "difficulty": "easy"
    },
    {
      "id": "DP-2",
      "topic": "strategia",
      "type": "true_false",
      "prompt": "Dinamikus programozásnál a részproblémák közti függés tartalmazhat ciklusokat is, ha az optimális.",
      "answer": false,
      "explanation": "A függésnek körmentesnek kell lennie, különben nem tudjuk jól alulról-felfelé számolni.",
      "difficulty": "medium"
    },
    {
      "id": "DP-3",
      "topic": "strategia",
      "type": "multiple_choice",
      "prompt": "Válaszd ki az ÖSSZES igaz állítást a dinamikus programozás stratégiájáról!",
      "options": [
        { "id": 1, "text": "Az optimális megoldás szerkezetének vizsgálatával kezdünk." },
        { "id": 2, "text": "A részproblémák megoldásait sosem tároljuk, mindig újraszámoljuk." },
        { "id": 3, "text": "A részproblémák megoldását gyakran táblázatban számoljuk ki alulról-felfelé." },
        { "id": 4, "text": "A módszer csak gráfos feladatokra alkalmazható." }
      ],
      "answer": [1, 3],
      "explanation": "1 és 3 a jegyzetben megadott stratégia részei; 2 hamis (pont tárolunk), 4 túl szűk.",
      "difficulty": "easy"
    },
    {
      "id": "LCS-1",
      "topic": "LCS",
      "type": "single_choice",
      "prompt": "Mit jelent L(i,j) a leghosszabb közös részsorozat feladatnál?",
      "options": [
        { "id": 1, "text": "Az X és Y teljes sorozatainak LCS hossza." },
        { "id": 2, "text": "Az X első i és Y első j eleméből képezhető LCS hossza." },
        { "id": 3, "text": "Az X i..n és Y j..m részének LCS hossza." },
        { "id": 4, "text": "A rossz részprobléma-definíció, ilyet nem használunk." }
      ],
      "answer": 2,
      "explanation": "A jegyzet szerint L(i,j) az X prefix(i) és Y prefix(j) LCS-ének hossza.",
      "difficulty": "easy"
    },
    {
      "id": "LCS-2",
      "topic": "LCS",
      "type": "multiple_choice",
      "prompt": "Válaszd ki az ÖSSZES igaz rekurziós összefüggést az LCS feladatnál!",
      "options": [
        { "id": 1, "text": "Ha i=0 vagy j=0, akkor L(i,j)=0." },
        { "id": 2, "text": "Ha X(i)=Y(j), akkor L(i,j)=L(i-1,j-1)+1." },
        { "id": 3, "text": "Ha X(i)≠Y(j), akkor L(i,j)=max(L(i-1,j),L(i,j-1))." },
        { "id": 4, "text": "Ha X(i)≠Y(j), akkor L(i,j)=L(i-1,j-1)." }
      ],
      "answer": [1, 2, 3],
      "explanation": "A 4. állítás hibás, pont ez különbözteti meg az eseteket.",
      "difficulty": "medium"
    },
    {
      "id": "LCS-3",
      "topic": "LCS",
      "type": "true_false",
      "prompt": "A memorizálásos rekurzív LCS megoldás ugyanazokat az értékeket újra meg újra kiszámolja.",
      "answer": false,
      "explanation": "A memorizálás lényege, hogy amit kiszámoltunk, azt eltároljuk, és nem számoljuk újra.",
      "difficulty": "easy"
    },
    {
      "id": "TOWER-1",
      "topic": "toronyepites",
      "type": "single_choice",
      "prompt": "Milyen feltételnek kell teljesülnie a stabil toronyban a kockákra?",
      "options": [
        { "id": 1, "text": "Felfelé haladva a méret és súly nem nőhet, csak csökkenhet." },
        { "id": 2, "text": "Felfelé haladva a méret nő, a súly tetszőleges." },
        { "id": 3, "text": "Csak a legkisebb kocka lehet legalul." },
        { "id": 4, "text": "Nincs semmilyen korlát, csak az elemszám számít." }
      ],
      "answer": 1,
      "explanation": "A feladat szerint stabil toronyban felfelé csökken mindkettő.",
      "difficulty": "easy"
    },
    {
      "id": "TOWER-2",
      "topic": "toronyepites",
      "type": "true_false",
      "prompt": "A Toronyépítés DP megoldásban Kocka(i) az a maximális magasság, amely az i-edik kockával a torony tetején érhető el.",
      "answer": true,
      "explanation": "Pont így definiáljuk: részprobléma = i a tetején.",
      "difficulty": "medium"
    },
    {
      "id": "KEMENCE-1",
      "topic": "kemence",
      "type": "match_pairs",
      "prompt": "Párosítsd a kemence feladatban használt jelöléseket a jelentésükkel!",
      "pairs": {
        "left": [
          "Idő(i)",
          "Db(i)",
          "Kivel(i)",
          "Éget(i)"
        ],
        "right": [
          "Az i. tárggyal együtt égetett tárgyak száma",
          "Az első i tárgy kiégetéséhez szükséges minimális idő",
          "A legkisebb sorszámú társ, akivel együtt égetjük az i. tárgyat",
          "Az i. tárgy minimális égetési ideje"
        ]
      },
      "answer": [2, 1, 3, 4],
      "explanation": "A jelölések megfelelnek a diák definícióinak.",
      "difficulty": "medium"
    },
    {
      "id": "TUKOR-1",
      "topic": "tukorszó",
      "type": "multiple_choice",
      "prompt": "Tükörszó feladat: mely állítások igazak?",
      "options": [
        { "id": 1, "text": "Az egybetűs szavak tükörszavak." },
        { "id": 2, "text": "Ha az első és utolsó betű egyforma, elég a köztes rész átalakítása." },
        { "id": 3, "text": "M(i,j) azt jelenti, hány karaktert törlünk, hogy tükörszó legyen." },
        { "id": 4, "text": "Ha az első és utolsó betű különbözik, két lehetőség: elsőt a végére vagy utolsót az elejére szúrjuk." }
      ],
      "answer": [1, 2, 4],
      "explanation": "M(i,j) a beszúrások számát méri, nem törlést.",
      "difficulty": "medium"
    },
    {
      "id": "ROD-1",
      "topic": "rud_darabolas",
      "type": "true_false",
      "prompt": "A rúd darabolás feladatnál egy vágás költsége az egész eredeti rúd hossza.",
      "answer": false,
      "explanation": "A vágás költsége mindig az éppen vágott aktuális darab hossza.",
      "difficulty": "easy"
    },
    {
      "id": "ROD-2",
      "topic": "rud_darabolas",
      "type": "single_choice",
      "prompt": "Miért működik a dinamikus programozás a rúd darabolás feladatnál?",
      "options": [
        { "id": 1, "text": "Mert az első vágás helye után a két rész optimális vágása független egymástól." },
        { "id": 2, "text": "Mert minden részre ugyanannyit vágunk." },
        { "id": 3, "text": "Mert a mohó: mindig középen vágunk, optimális." },
        { "id": 4, "text": "Mert csak egyetlen lehetséges vágási sorrend van." }
      ],
      "answer": 1,
      "explanation": "Optimális struktúra: ha K az első vágás, mindkét oldalon optimális rész-megoldás van.",
      "difficulty": "medium"
    },
    {
      "id": "KNAP-1",
      "topic": "hatizsak",
      "type": "single_choice",
      "prompt": "Melyik írja le helyesen az E(X,i) DP átmenetet a hátizsák feladatban?",
      "options": [
        { "id": 1, "text": "E(X,i)=E(X,i-1)+E(X-S(i),i-1)" },
        { "id": 2, "text": "E(X,i)=max(E(X,i-1), E(X-S(i),i-1)+F(i))" },
        { "id": 3, "text": "E(X,i)=min(E(X,i-1),F(i))" },
        { "id": 4, "text": "E(X,i)=F(i), ha S(i)≤X, különben 0" }
      ],
      "answer": 2,
      "explanation": "Klasszikus 0-1 hátizsák rekurzió.",
      "difficulty": "easy"
    },
    {
      "id": "KNAP-2",
      "topic": "hatizsak",
      "type": "true_false",
      "prompt": "Ha E(X,i)=E(X,i-1), akkor az i. tárgyat nem tesszük be a hátizsákba.",
      "answer": true,
      "explanation": "Kiírásnál ezt használjuk a tárgyak visszafejtéséhez.",
      "difficulty": "easy"
    },
    {
      "id": "COIN-1",
      "topic": "penzvaltas_reszosszeg",
      "type": "multiple_choice",
      "prompt": "Adott pénzjegyekből kifizethető-e F összeg? Válaszd ki az igaz állításokat!",
      "options": [
        { "id": 1, "text": "V(X,i) igaz, ha X kifizethető az első i pénzjegyből." },
        { "id": 2, "text": "V(X,i) igaz lehet akkor is, ha X<0." },
        { "id": 3, "text": "V(X,i) igaz, ha V(X,i-1) igaz, vagy használjuk az i. pénzjegyet." },
        { "id": 4, "text": "A naiv megoldás exponenciális, a DP megoldás O(N*F)." }
      ],
      "answer": [1, 3, 4],
      "explanation": "Az X<0 eseteket nem engedjük; a többiek a diák állításai.",
      "difficulty": "medium"
    },
    {
      "id": "COIN-2",
      "topic": "penzcimlet_valasztas",
      "type": "single_choice",
      "prompt": "Mit tárol V(X,i) a 'pénzcímlet kiválasztás' DP változatban?",
      "options": [
        { "id": 1, "text": "Azt, hogy igaz/hamis módon kifizethető-e X." },
        { "id": 2, "text": "Az utolsó felhasznált pénzcímlet indexét X felbontásában, vagy N+1-et, ha nem lehet." },
        { "id": 3, "text": "Az összes felhasznált címlet darabszámát." },
        { "id": 4, "text": "A minimális címletszámot X-re." }
      ],
      "answer": 2,
      "explanation": "Így tudjuk visszafejteni, mely címletek kellenek.",
      "difficulty": "hard"
    },
    {
      "id": "SIBLING-1",
      "topic": "testveries_osztozkodas",
      "type": "single_choice",
      "prompt": "A testvéries osztozkodás feladat célja:",
      "options": [
        { "id": 1, "text": "Az egyik testvér értéke maximális legyen." },
        { "id": 2, "text": "A két testvér kapott összértéke közti különbség minimális legyen." },
        { "id": 3, "text": "Mindketten ugyanazokat az ajándékokat kapják." },
        { "id": 4, "text": "A lehető legkevesebb ajándékot használjuk fel." }
      ],
      "answer": 2,
      "explanation": "Ez a 'testvéries' definíció a jegyzetben.",
      "difficulty": "easy"
    },
    {
      "id": "TREASURE-1",
      "topic": "kincs",
      "type": "match_pairs",
      "prompt": "Párosítsd a kincsgyűjtős DP feladat jelöléseit a jelentésükkel!",
      "pairs": {
        "left": [
          "Gy(i,j)",
          "Kincs(i,j)='*'",
          "Kincs(i,j)='+'",
          "Gy(N,M)"
        ],
        "right": [